armiger,image_url,blazon,artist,date_granted
Yli-Ii,https://upload.wikimedia.org/wikipedia/commons/thumb/1/11/Yli-ii.vaakuna.svg/75px-Yli-ii.vaakuna.svg.png,"Sinisessä kentässä pystyasennossa kaksi kahtaalle suuntautuvaa yksipolvekkeista kultasalamaa, joiden kärjet muodostavat apilanlehden.",Kaj Kajander,21. heinäkuuta 1967
Ylikiiminki,https://upload.wikimedia.org/wikipedia/commons/thumb/e/e1/Ylikiiminki.vaakuna.svg/75px-Ylikiiminki.vaakuna.svg.png,Sinisessä kentässä kolme kultaista pajurekeä alakkain.,Oskari JauhiainenjaOlof Eriksson,3. toukokuuta 1957
Ylimarkku,https://upload.wikimedia.org/wikipedia/commons/thumb/1/19/Ylimarkku.vaakuna.svg/75px-Ylimarkku.vaakuna.svg.png,Sinisessä kentässä aaltokoroinen palkki; saatteena kaksi paaluittaista lyhdettä; kaikki hopeaa.,G. Lindström,8. kesäkuuta 1968
Ylistaro,https://upload.wikimedia.org/wikipedia/commons/thumb/7/7f/Ylistaro.vaakuna.svg/120px-Ylistaro.vaakuna.svg.png,Vihreässä kentässä kaksihaarainen kultalyhde.,Ahti Hammar,17. lokakuuta 1961
Ylämaa,https://upload.wikimedia.org/wikipedia/commons/thumb/4/4d/Yl%C3%A4maa.vaakuna.svg/120px-Yl%C3%A4maa.vaakuna.svg.png,Vihreässä kentässä havukoroinen hopealakio.,Olof Eriksson,21. elokuuta 1964
Yläne,https://upload.wikimedia.org/wikipedia/commons/thumb/6/6a/Yl%C3%A4ne.vaakuna.svg/75px-Yl%C3%A4ne.vaakuna.svg.png,"Kilpi katkoinen, yläkenttä punainen ja alakenttä kultaa, josta kasvaa kolme kultaista kuusta; alakentässä punainen hirsi.",Gustaf von Numers,22. lokakuuta 1957
Äetsä,https://upload.wikimedia.org/wikipedia/commons/thumb/d/db/%C3%84ets%C3%A4.vaakuna.svg/75px-%C3%84ets%C3%A4.vaakuna.svg.png,"Sinisessä kentässä nahkatyömeisti, sen varren molemmilla puolilla saatteena kolmiapila; kaikki kultaa.",Kaj Kajander,1. tammikuuta 1981
Ähtävä,https://upload.wikimedia.org/wikipedia/commons/thumb/e/e7/%C3%84ht%C3%A4v%C3%A4.vaakuna.svg/120px-%C3%84ht%C3%A4v%C3%A4.vaakuna.svg.png,"Kultakentässä aaltokoroinen, yläinen hirsi ja sen alapuolella neljä kissankelloa, joiden varret yhtyvät ristiksi; kaikki sinisiä.",Gustaf von Numers,10. huhtikuuta 1962
Äänekosken maalaiskunta,https://upload.wikimedia.org/wikipedia/commons/thumb/7/78/%C3%84%C3%A4nekosken_mlk.vaakuna.svg/120px-%C3%84%C3%A4nekosken_mlk.vaakuna.svg.png,Hopeakentässä reunoihin ulottuva punainen jousikaarisilta.,Ahti Hammar,30. kesäkuuta 1958
Äänekoski,https://upload.wikimedia.org/wikipedia/commons/thumb/a/a4/%C3%84%C3%A4nekoski.vaakuna.1954.svg/120px-%C3%84%C3%A4nekoski.vaakuna.1954.svg.png,"Mustassa kentässä aaltokoroinen hopeapalkki, jossa kolme hirsittäistä, punaista torvea hihnoineen.",Gustaf von Numers,14. lokakuuta 1954
Öja,https://upload.wikimedia.org/wikipedia/commons/thumb/c/cf/%C3%96ja.vaakuna.svg/120px-%C3%96ja.vaakuna.svg.png,"Kultakentässä nouseva musta majakka, jonka lyhdyn ruudut hopeaa.",Gustaf von Numers,18. syyskuuta 1959
